{
  "collected_at": "2026-09-29T12:00:44Z",
  "error": null,
  "operation": "DescribeSecurityGroups",
  "region": "us-east-1",
  "request": {},
  "response": {
    "SecurityGroups": [
      {
        "Description": "default VPC security group",
        "GroupId": "sg-d3f25076d5c16e645",
        "GroupName": "default",
        "IpPermissions": [],
        "IpPermissionsEgress": [
          {
            "IpProtocol": "-1",
            "IpRanges": [
              {
                "CidrIp": "0.0.0.0/0"
              }
            ],
            "Ipv6Ranges": [],
            "PrefixListIds": [],
            "UserIdGroupPairs": []
          }
        ],
        "OwnerId": "[ACCOUNT]",
        "SecurityGroupArn": "arn:aws:ec2:us-east-1:[ACCOUNT]:security-group/sg-d3f25076d5c16e645",
        "Tags": [],
        "VpcId": "vpc-fa5eb40912543c2a0"
      },
      {
        "Description": "synthetic",
        "GroupId": "sg-1f642c312c21036a5",
        "GroupName": "cp-demo-open-ssh",
        "IpPermissions": [
          {
            "FromPort": 22,
            "IpProtocol": "tcp",
            "IpRanges": [
              {
                "CidrIp": "0.0.0.0/0"
              }
            ],
            "Ipv6Ranges": [],
            "PrefixListIds": [],
            "ToPort": 22,
            "UserIdGroupPairs": []
          }
        ],
        "IpPermissionsEgress": [
          {
            "IpProtocol": "-1",
            "IpRanges": [
              {
                "CidrIp": "0.0.0.0/0"
              }
            ],
            "Ipv6Ranges": [],
            "PrefixListIds": [],
            "UserIdGroupPairs": []
          }
        ],
        "OwnerId": "[ACCOUNT]",
        "SecurityGroupArn": "arn:aws:ec2:us-east-1:[ACCOUNT]:security-group/sg-1f642c312c21036a5",
        "Tags": [],
        "VpcId": "vpc-fa5eb40912543c2a0"
      }
    ]
  },
  "schema_version": "1.0.0",
  "service": "ec2"
}
