{
  "collected_at": "2026-09-29T12:00:38Z",
  "error": null,
  "operation": "GetBucketEncryption",
  "region": null,
  "request": {
    "Bucket": "cp-demo-kms"
  },
  "response": {
    "ServerSideEncryptionConfiguration": {
      "Rules": [
        {
          "ApplyServerSideEncryptionByDefault": {
            "KMSMasterKeyID": "alias/aws/s3",
            "SSEAlgorithm": "aws:kms"
          },
          "BucketKeyEnabled": false
        }
      ]
    }
  },
  "schema_version": "1.0.0",
  "service": "s3"
}
